{
  "schema_version": "1.0",
  "scenario_id": "verified-ssh-inventory",
  "name": "Verified SSH access to bounded inventory",
  "category": "verified_ssh_inventory",
  "lab": {"name": "octopus-replay-lab", "version": "1.0"},
  "target": {"kind": "recorded-ssh-host", "version": "ssh-inventory-v1", "fixture_ref": "ssh-inventory-v1"},
  "model": {"provider": "deterministic-replay", "name": "pipeline-runtime", "parameters": {"temperature": 0}},
  "tool_versions": {"ssh_inventory": "1.0", "mission_store": "1.0"},
  "strategy_config": {"mode": "replay", "authorized_access": true},
  "seed": 404,
  "budgets": {"max_tools": 6, "max_seconds": 60, "max_output_bytes": 1000000},
  "allowed_actions": ["verify_ssh_access", "replay_bounded_inventory"],
  "ground_truth": {"expected_findings": ["ssh_access", "host_inventory"], "forbidden_findings": ["persistence_created"], "expected_status": "succeeded"},
  "artifacts": {"inputs": ["fixture://ssh-inventory-v1"], "results": []},
  "repetitions": 5,
  "ablations": [],
  "tags": ["replay", "ssh", "inventory"]
}
