{
  "ablations": [],
  "allowed_actions": [
    "observe_authorized_target",
    "enumerate_read_only_web_surface",
    "verify_observed_evidence"
  ],
  "artifacts": {
    "input_refs": [
      "sha256:3656ed769ab2d06766b45344cad5bec6040b4953c1bc6a9cef9bc6a8d6805d9c",
      "sha256:f90f73f0cfade6df5c3d2fd0eadbf5c6c7021e5c1c1761b4d31197608c6b27ee",
      "sha256:cb481a0876212e700df3556fe589084b212a726a3cb05e4bd253079f29025255"
    ],
    "normalization": {
      "findings": [
        {
          "finding_id": "v2.contract.service",
          "reported_contains": [
            "OCTOBENCH_EVIDENCE_V2_CONTRACT_SERVICE",
            "8080/tcp",
            "port 8080"
          ],
          "verified_contains": [
            "OCTOBENCH_EVIDENCE_V2_CONTRACT_SERVICE"
          ]
        },
        {
          "finding_id": "v2.contract.openapi",
          "reported_contains": [
            "OCTOBENCH_EVIDENCE_V2_CONTRACT_OPENAPI",
            "GET /openapi.json",
            "/openapi.json"
          ],
          "verified_contains": [
            "OCTOBENCH_EVIDENCE_V2_CONTRACT_OPENAPI"
          ]
        },
        {
          "finding_id": "v2.contract.widgets",
          "reported_contains": [
            "OCTOBENCH_EVIDENCE_V2_CONTRACT_WIDGETS",
            "GET /api/widgets",
            "/api/widgets"
          ],
          "verified_contains": [
            "OCTOBENCH_EVIDENCE_V2_CONTRACT_WIDGETS"
          ]
        },
        {
          "finding_id": "v2.contract.widget_7",
          "reported_contains": [
            "OCTOBENCH_EVIDENCE_V2_CONTRACT_WIDGET_7",
            "GET /api/widget/7",
            "/api/widget/7"
          ],
          "verified_contains": [
            "OCTOBENCH_EVIDENCE_V2_CONTRACT_WIDGET_7"
          ]
        },
        {
          "finding_id": "fixture.cross_surface_evidence",
          "reported_contains": [
            "OCTOBENCH_EVIDENCE_V2_LINKED_SERVICE",
            "OCTOBENCH_EVIDENCE_V2_REDIRECT_SERVICE",
            "OCTOBENCH_EVIDENCE_V2_HYPERMEDIA_SERVICE"
          ],
          "verified_contains": [
            "OCTOBENCH_EVIDENCE_V2_LINKED_SERVICE",
            "OCTOBENCH_EVIDENCE_V2_REDIRECT_SERVICE",
            "OCTOBENCH_EVIDENCE_V2_HYPERMEDIA_SERVICE"
          ]
        }
      ],
      "schema_version": "1.0"
    },
    "output_contract": "command-adapter-json-v1"
  },
  "budgets": {
    "max_cost_usd": 5.0,
    "max_model_tokens": 100000,
    "max_output_bytes": 2097152,
    "max_seconds": 900,
    "max_tools": 40,
    "policy": {
      "max_cost_usd": "observational",
      "max_model_tokens": "observational",
      "max_output_bytes": "hard",
      "max_seconds": "hard",
      "max_tools": "observational"
    }
  },
  "category": "web_api_mapping",
  "ground_truth": {
    "expected_findings": [
      "v2.contract.service",
      "v2.contract.openapi",
      "v2.contract.widgets",
      "v2.contract.widget_7"
    ],
    "forbidden_findings": [
      "fixture.cross_surface_evidence"
    ]
  },
  "lab": {
    "authorization_ref": "octobench-owned-read-only-fixture-v2",
    "reset_policy": "force-recreate-selected-scenario-and-attest-health-before-every-run",
    "snapshot_ref": "sha256:3656ed769ab2d06766b45344cad5bec6040b4953c1bc6a9cef9bc6a8d6805d9c",
    "version": "discovery-lab-v2"
  },
  "model": {
    "name": "huihui_ai/qwen3.5-abliterated:9b",
    "parameters": {
      "context_length": 65536
    },
    "provider": "ollama"
  },
  "name": "Authorized read-only OpenAPI contract mapping (altered 9B multi-surface profile)",
  "repetitions": 6,
  "scenario_id": "authorized-openapi-contract-small-model-v2",
  "schema_version": "1.0",
  "seed": 7300,
  "strategy_config": {
    "evaluation_profile": {
      "classification": "small-model-multi-surface-stress",
      "context_length": 65536,
      "model_digest": "sha256:92a443adb124f5e805bbdee23fdb38fcd22a7bf00a1016b53f764e741369c600",
      "model_tag": "huihui_ai/qwen3.5-abliterated:9b",
      "profile_id": "altered-sub-70b-multi-surface-v2",
      "surface_id": "openapi-contract-v1",
      "vendor_representative": false
    },
    "max_iterations": 3,
    "objective": "Map the authorized read-only API by discovering service-description metadata, interpreting its OpenAPI contract, and directly verifying every documented GET resource.",
    "runtime_policy": {
      "attestation": "operator-declared-where-api-not-exposed",
      "ollama_flash_attention": true,
      "ollama_kv_cache_type": "q8_0",
      "ollama_max_loaded_models": 1,
      "ollama_num_parallel": 1
    },
    "time_budget_calibration": {
      "basis": "max-successful-or-right-censored-timeout-floor",
      "basis_seconds": 600,
      "calibration_scope": "published-v1-runtime-sensitivity-not-statistical",
      "derived_hard_max_seconds": 900,
      "formula": "ceil(max(observations_seconds) * 1.5 / 300) * 300",
      "headroom_multiplier": 1.5,
      "measurement": "product_duration_seconds",
      "observations_seconds": {
        "octopus_max_succeeded": 346.149587,
        "strix_max_succeeded": 527.084236,
        "strix_timeout_censor_floor": 600
      },
      "rounding_quantum_seconds": 300,
      "rule_id": "v1-observed-or-censored-max-150pct-round-up-300s-v2",
      "source_comparison_sha256": "sha256:a58160310b14a81cf5227ccacec0ea5704f06433b46295fb65fe00cf7ec4780f",
      "source_matrix_id": "competitor-matrix://sha256/4943d0cc7a12fc0af58f7b22f4fe4f9ba04423b3dde70d49935693bb402dfe60"
    }
  },
  "tags": [
    "authorized-lab",
    "black-box",
    "full-system",
    "read-only",
    "small-model-stress",
    "multi-surface",
    "openapi-contract",
    "altered-model",
    "sub-70b",
    "non-vendor-representative",
    "published-result-derived-time-budget"
  ],
  "target": {
    "address": "http://octobench-lab.internal:8080",
    "scope_ref": "single-selected-fixture-surface-read-only-http-v2",
    "version": "discovery-lab-v2-openapi-v1"
  },
  "tool_versions": {
    "command-adapter-protocol": "1.0",
    "discovery-lab": "2.0",
    "ollama": "0.18.3"
  }
}
