{
  "schema_version": "1.0",
  "scenario_id": "timeout-partial-result",
  "name": "Timeout with partial result persistence",
  "category": "timeout_partial_result",
  "lab": {"name": "octopus-replay-lab", "version": "1.0"},
  "target": {"kind": "recorded-timeout", "version": "timeout-v1", "fixture_ref": "timeout-partial-v1"},
  "model": {"provider": "deterministic-replay", "name": "pipeline-runtime", "parameters": {"temperature": 0}},
  "tool_versions": {"execution_result": "1.0", "cancellation": "1.0"},
  "strategy_config": {"mode": "replay", "persist_partial": true},
  "seed": 707,
  "budgets": {"max_tools": 5, "max_seconds": 20, "max_output_bytes": 250000},
  "allowed_actions": ["replay_partial_result", "record_coverage_gap"],
  "ground_truth": {"expected_findings": ["partial_evidence", "coverage_gap"], "forbidden_findings": ["complete_coverage"], "expected_status": "succeeded"},
  "artifacts": {"inputs": ["fixture://timeout-partial-v1"], "results": []},
  "repetitions": 5,
  "ablations": [],
  "tags": ["replay", "timeout", "partial"]
}
