{
  "schema_version": "1.0",
  "scenario_id": "authorized-linked-navigation-small-model-v2",
  "name": "Authorized read-only linked navigation (altered 9B multi-surface profile)",
  "category": "service_discovery_verification",
  "lab": {
    "version": "discovery-lab-v2",
    "authorization_ref": "octobench-owned-read-only-fixture-v2",
    "snapshot_ref": "sha256:3656ed769ab2d06766b45344cad5bec6040b4953c1bc6a9cef9bc6a8d6805d9c",
    "reset_policy": "force-recreate-selected-scenario-and-attest-health-before-every-run"
  },
  "target": {
    "version": "discovery-lab-v2-linked-v1",
    "address": "http://octobench-lab.internal:8080",
    "scope_ref": "single-selected-fixture-surface-read-only-http-v2"
  },
  "model": {
    "provider": "ollama",
    "name": "huihui_ai/qwen3.5-abliterated:9b",
    "parameters": {
      "context_length": 65536
    }
  },
  "tool_versions": {
    "command-adapter-protocol": "1.0",
    "discovery-lab": "2.0",
    "ollama": "0.18.3"
  },
  "strategy_config": {
    "objective": "Map the authorized HTTP service by following ordinary HTML navigation and API documentation, then directly verify every observed read-only endpoint.",
    "max_iterations": 3,
    "evaluation_profile": {
      "profile_id": "altered-sub-70b-multi-surface-v2",
      "classification": "small-model-multi-surface-stress",
      "surface_id": "linked-navigation-v1",
      "vendor_representative": false,
      "model_tag": "huihui_ai/qwen3.5-abliterated:9b",
      "model_digest": "sha256:92a443adb124f5e805bbdee23fdb38fcd22a7bf00a1016b53f764e741369c600",
      "context_length": 65536
    },
    "runtime_policy": {
      "ollama_flash_attention": true,
      "ollama_kv_cache_type": "q8_0",
      "ollama_num_parallel": 1,
      "ollama_max_loaded_models": 1,
      "attestation": "operator-declared-where-api-not-exposed"
    },
    "time_budget_calibration": {
      "rule_id": "v1-observed-or-censored-max-150pct-round-up-300s-v2",
      "source_matrix_id": "competitor-matrix://sha256/4943d0cc7a12fc0af58f7b22f4fe4f9ba04423b3dde70d49935693bb402dfe60",
      "source_comparison_sha256": "sha256:a58160310b14a81cf5227ccacec0ea5704f06433b46295fb65fe00cf7ec4780f",
      "measurement": "product_duration_seconds",
      "observations_seconds": {
        "octopus_max_succeeded": 346.149587,
        "strix_max_succeeded": 527.084236,
        "strix_timeout_censor_floor": 600
      },
      "basis": "max-successful-or-right-censored-timeout-floor",
      "basis_seconds": 600,
      "headroom_multiplier": 1.5,
      "rounding_quantum_seconds": 300,
      "formula": "ceil(max(observations_seconds) * 1.5 / 300) * 300",
      "derived_hard_max_seconds": 900,
      "calibration_scope": "published-v1-runtime-sensitivity-not-statistical"
    }
  },
  "seed": 7200,
  "budgets": {
    "max_tools": 40,
    "max_seconds": 900,
    "max_output_bytes": 2097152,
    "max_model_tokens": 100000,
    "max_cost_usd": 5.0,
    "policy": {
      "max_tools": "observational",
      "max_seconds": "hard",
      "max_output_bytes": "hard",
      "max_model_tokens": "observational",
      "max_cost_usd": "observational"
    }
  },
  "allowed_actions": [
    "observe_authorized_target",
    "enumerate_read_only_web_surface",
    "verify_observed_evidence"
  ],
  "ground_truth": {
    "expected_findings": [
      "v2.linked.service",
      "v2.linked.health",
      "v2.linked.openapi",
      "v2.linked.items"
    ],
    "forbidden_findings": [
      "fixture.cross_surface_evidence"
    ]
  },
  "artifacts": {
    "input_refs": [
      "sha256:3656ed769ab2d06766b45344cad5bec6040b4953c1bc6a9cef9bc6a8d6805d9c",
      "sha256:f90f73f0cfade6df5c3d2fd0eadbf5c6c7021e5c1c1761b4d31197608c6b27ee",
      "sha256:cb481a0876212e700df3556fe589084b212a726a3cb05e4bd253079f29025255"
    ],
    "output_contract": "command-adapter-json-v1",
    "normalization": {
      "schema_version": "1.0",
      "findings": [
        {
          "finding_id": "v2.linked.service",
          "reported_contains": ["OCTOBENCH_EVIDENCE_V2_LINKED_SERVICE", "8080/tcp", "port 8080"],
          "verified_contains": ["OCTOBENCH_EVIDENCE_V2_LINKED_SERVICE"]
        },
        {
          "finding_id": "v2.linked.health",
          "reported_contains": ["OCTOBENCH_EVIDENCE_V2_LINKED_HEALTH", "GET /health", "/health"],
          "verified_contains": ["OCTOBENCH_EVIDENCE_V2_LINKED_HEALTH"]
        },
        {
          "finding_id": "v2.linked.openapi",
          "reported_contains": ["OCTOBENCH_EVIDENCE_V2_LINKED_OPENAPI", "GET /openapi.json", "/openapi.json"],
          "verified_contains": ["OCTOBENCH_EVIDENCE_V2_LINKED_OPENAPI"]
        },
        {
          "finding_id": "v2.linked.items",
          "reported_contains": ["OCTOBENCH_EVIDENCE_V2_LINKED_ITEMS", "GET /api/items", "/api/items"],
          "verified_contains": ["OCTOBENCH_EVIDENCE_V2_LINKED_ITEMS"]
        },
        {
          "finding_id": "fixture.cross_surface_evidence",
          "reported_contains": [
            "OCTOBENCH_EVIDENCE_V2_CONTRACT_SERVICE",
            "OCTOBENCH_EVIDENCE_V2_REDIRECT_SERVICE",
            "OCTOBENCH_EVIDENCE_V2_HYPERMEDIA_SERVICE"
          ],
          "verified_contains": [
            "OCTOBENCH_EVIDENCE_V2_CONTRACT_SERVICE",
            "OCTOBENCH_EVIDENCE_V2_REDIRECT_SERVICE",
            "OCTOBENCH_EVIDENCE_V2_HYPERMEDIA_SERVICE"
          ]
        }
      ]
    }
  },
  "repetitions": 5,
  "tags": [
    "authorized-lab",
    "black-box",
    "full-system",
    "read-only",
    "small-model-stress",
    "multi-surface",
    "linked-navigation",
    "altered-model",
    "sub-70b",
    "non-vendor-representative",
    "published-result-derived-time-budget"
  ]
}
