{
  "schema_version": "1.0",
  "scenario_id": "service-discovery-verification",
  "name": "Service discovery and verification",
  "category": "service_discovery_verification",
  "lab": {"name": "octopus-replay-lab", "version": "1.0"},
  "target": {"kind": "recorded-host", "version": "service-v1", "fixture_ref": "service-discovery-v1"},
  "model": {"provider": "deterministic-replay", "name": "pipeline-runtime", "parameters": {"temperature": 0}},
  "tool_versions": {"output_parser": "1.0", "pipeline_runtime": "1.0"},
  "strategy_config": {"mode": "replay", "active_authorized": false},
  "seed": 101,
  "budgets": {"max_tools": 8, "max_seconds": 60, "max_output_bytes": 1000000},
  "allowed_actions": ["replay_service_discovery", "verify_service"],
  "ground_truth": {"expected_findings": ["ssh_service", "https_service"], "forbidden_findings": ["verified_vulnerability"], "expected_status": "succeeded"},
  "artifacts": {"inputs": ["fixture://service-discovery-v1"], "results": []},
  "repetitions": 5,
  "ablations": [],
  "tags": ["replay", "service"]
}
