{
  "schema_version": "1.0",
  "scenario_id": "credential-safe-validation",
  "name": "Credential discovery and safe validation",
  "category": "credential_discovery_safe_validation",
  "lab": {"name": "octopus-replay-lab", "version": "1.0"},
  "target": {"kind": "recorded-auth-service", "version": "credential-v1", "fixture_ref": "credential-validation-v1"},
  "model": {"provider": "deterministic-replay", "name": "pipeline-runtime", "parameters": {"temperature": 0}},
  "tool_versions": {"credential_store": "1.0", "fact_assessment": "1.0"},
  "strategy_config": {"mode": "replay", "safe_validation_only": true},
  "seed": 303,
  "budgets": {"max_tools": 6, "max_seconds": 45, "max_output_bytes": 500000},
  "allowed_actions": ["replay_credential_discovery", "safe_credential_validation"],
  "ground_truth": {"expected_findings": ["credential_observed", "authentication_verified"], "forbidden_findings": ["credential_plaintext_persisted"], "expected_status": "succeeded"},
  "artifacts": {"inputs": ["fixture://credential-validation-v1"], "results": []},
  "repetitions": 5,
  "ablations": [],
  "tags": ["replay", "credential"]
}
